review,category,score,vui chơi,lưu trú,nhà hàng,ăn uống,vận chuyển,mua sắm
"Nằm trong khu chợ Đà Lạt đi lòng vòng hơn khó tìm mấy bạn tìm theo số sạp đó. Cô bán dễ thương, cho ăn thử tất cả loại mức xong giới thiệu cho loại nào ngon, loại nào dở mùa này không nên mua. Thật ra ăn thử không mua cũng không sao cô dễ thương lắm không mua không bị chửi giống mấy bà trong chợ, cho ăn cả maCa đà lạt. Mua đồ nhiều cô còn tặng thêm mứt này mứt kia. Mua đồ là cô cho cái túi tái sử dụng để dễ xách luôn. Không gian sạp hơi nhỏ nên không trưng bày nhiều muốn mua gì hỏi chị đó lấy cho, có hết đó. Đồ ăn chất lượng, chị bán đồ ngon không, mấy thứ mứt dở chị không lấy bán. Có cả dịch vụ ép chân không cho ai có nhu cầu. Cần thì chị có gửi mứt theo xe khách xuống thành phố luôn",shop,8.6,0,0,0,0,0,4
"Sở hữu thực đơn đa dạng và đặc sắc, món ăn tại Cát Khánh VeGetarian FOd không chỉ thơm ngon mà còn được trình bày tỉ mỉ, đẹp mắt. Nguyên liệu chế biến hoàn toàn từ rau củ, nấm, tàu hủ,… thuần khiết, khiến bất kì ai một lần thưởng thức cũng khó có thể quên được. Quán nổi tiếng nhất món bánh xèo chay được làm bằng nhân đậu xanh nên rất thơm ngon mà lại không bị ngán, rất phù hợp cho các tìn đồ ăn chay và bạn nào muốn đổi vị, không muốn ăn nhiều dầu mỡ, muốn ăn thanh đạm tốt cho sức khoẻ thì đến ngay quán này nhé. Không gian quán rất thoáng, thoải mái, phù hợp cho gia đình chiều tối đến thưởng thức. Quán nằm trung tâm nên thuận lợi cho dân văn phòng nữa nè.",foods,9.6,0,0,0,5,0,0
Nước sâm ngon.,foods,8.6,0,0,0,5,0,0
"Vừa ghé qua sân bay quốc tế Tân Sơn Nhất để bay ra Hà Nội công tác nhiều ngày bằng hãng hàng không Vietnam Airlines, về không gian của sân bay Tân Sơn Nhất hay chất lượng dịch vụ tại nơi đây thì không có nhiều yếu tố để bàn luận nhưng xét về phong cách phục vụ của Vietnam Airlines thì khá chuyên nghiệp, hướng dẫn tận tình và giải quyết rắc rối cho khách khi cần thiết. Do mình di chuyển cũng khá gấp nên chưa đầu tư tham quan và chụp ảnh để đăng trên FOdy được nhiều.",travel,9.6,0,0,0,0,4,0
"Tụi mình từ Ninh Thuận chạy lên đây đi theo quốc lộ 702 nên có thể nói chưa tới khu resort thì cảnh trên đường đã đẹp rồi.Khu du lịch có đường khó vào nên thực sự dù đã được review trước đó nên mình cũng không tin được lại có 1 khu du lịch xinh đẹp thế này với đường xa hẻo lánh. Resort thu 50k 1 người bao nằm võng trên biển, xích đu và tắm nước ngọt, mình thích nhất là có cái võng trên biển, vừa nằm sóng đánh dập dìu thoải mái mà vừa check in cực sang chảnh luôn. Khu du lịch có nhiều cặp đôi tới chụp ảnh cưới , có nhà hàng trong khu du lịch, có phòng khách sạn và cả homestay loại nhỏ được gọi là thị trấn tý nị luôn. Nói chung là khu đẹp nè, rất đáng đi trong hè này.",travel,8.8,5,5,0,0,0,0
Thái độ nhân viên. từ thu ngân tới bán hàng không tôn trọng khách Đi 5 lần là 5 lần y chang Ko bao giờ tôi quay lại. Cần training lại tất cả các nhân viên đặc biệt là cửa hàng Phan Xích Long .,shop,1.0,0,0,0,0,0,0
"Cuối tuần vừa rồi mấy chị rủ đi đây nghỉ dưỡng, thư giãn. Ở đây thích lắm luôn, toàn cây cối, sông nước mát ơi là mát. Mình bOk phòng cho 2 người hình như tầm 1tr6 á, luôn cả ăn 3 bữa. Phòng lợp mái lá, giữa sông, dùng quạt nha, gần gũi với thiên nhiên. Nhà vệ sinh lộ thiên nha, , tối tắm hơi ghê. Đồ ăn siêu ngon, rau củ toàn tự trồng, cà chua siêu ngon, ngọt lắm. Buổi sáng ăn bánh canh, trưa được ăn cơm với trứng, cá kho, canh bí. Tối được ăn đồ nướng. Tới đây được chèo thuyền, câu cá tự tay hái rau. Cuối tuần trốn ồn ào lý tưởng lắm nha.",travel,7.0,0,5,0,0,5,0
"Mình đặt 2 cốc sữa chua mít và 1 cốc chè thái mít mà tuyệt nhiên cả 3 cốc không có miếng mít nào ? ? Biết là có giảm 30 và frEship qua Now nhưng chất lượng không thể chấp nhận nổi. Nếu hết đồ thì quán phải báo giao hàng gọi cho khách để đổi món chứ không thể làm ăn kiểu treo đầu dê bán thịt chó như thế được. Chè thì nhạt toẹt chẳng có vị gì, hạt lựu cứng như để từ hôm qua. Gọi cốc sữa chua với chè mít mà lõng bõng vài miếng thạch với thái xanh. Mình chẳng hiểu sao các bạn lại có thể khen được chè ở đây. Không bao giờ quay lại.",foods,1.0,0,0,0,1,0,0
"Cuối tuần vừa thèm bánh ngọt vừa thèm hải sản xiên nướng mà lười ghé nhiều chỗ thì ghé khách sạn TC đối diện cầu đi bộ ăn buFet là thoả mãn liền. Giá vé người lớn 198k vé, trẻ em 119k vé, mua 2 vé được miễn phí thêm 1 trẻ em dưới 6 tuổi. Thấy trên vé giới thiệu mua 2 vé được tặng voucher uống cafe ở tầng 8 mà hỏi thì nhân viên báo chương trình kết thúc hồi đầu tháng 9 vì quầy nước đã bổ sung thêm nước ngọt cho khách, nghe đâu voucher trị giá 10k hà. Menu buFet đặt ngay cửa ra vào, thay đổi mỗi tuần. Trước khi mua vé có thể tham khảo menu hôm đó có hợp ý mình không. Quầy xiên nướng các món sò lông, cá trứng chỉ có 1 mâm, hết rồi không châm thêm. Xiên nướng được làm chín sẵn, khách muốn ăn nóng nhân viên sẽ nướng lại bằng bếp than bên cạnh. Menu có bánh xèo bánh khọt nhưng tìm mỏi mắt không thấy mà đi ăn 1 vòng xong quên hỏi nhân viên luôn, gà nấu nho thì được thay bằng bò nấu nho. Thái độ nhân viên thân thiện nhiệt tình, ra quầy nướng chọn món xong nhờ nướng cho nóng, khách không cần đứng đợi, nướng xong bếp tự mang vào bàn cho khách. Nước thì chỉ có nước ngọt đựng trong bình có vòi rót nên không còn hơi ga , trà, nước lọc.",travel,6.0,0,0,0,5,0,0
Yến sào tốt tại đăk lăk,shop,8.6,0,0,0,5,0,0
Mình đến đây chơi dịp giáng sinh và năm mới nên khu thương mại này trang trí khá đẹp. Mình không thường hay đi chơi ở Time City lắm mà hay đi ở Royal city hơn. Ở Time thì không gian rộng hơn rất nhiều và cũng có nhiều nhãn hàng hơn. Các tiểu cảnh và trang trí ở chỗ này cũng rộng và đặc sắc hơn. Người đến chơi ở Time đông hơn. Bên ngoài khu thương mại có các điểm tập thể thao vào ngồi ngắm cảnh thoải mái và cho người ở bên ngoài khu dân cư sử dụng nên cuối tuần mang gia đình đến đây chơi rất phù hợp.,shop,7.0,0,0,0,0,0,4
Quốc tự giám,travel,8.0,0,5,0,0,0,0
"Nếu muốn mua đồ Hàn thì nên đến đây, có rất nhiều sản phẩm nhập khẩu từ Hàn như mỳ gói, kim chị, rong biển..... Đây cũng là siêu thị Duy nhất ở ĐN miễn phí tiền giữ xe cho khách, các siêu thị khác đều thu từ 1 2k. Mình hay đến đây mua đồ Hàn hoặc bánh mỳ, còn các đồ khác thì giá đắt hơn siêu thị khác một chút. Siêu thị khá rộng và không quá đông, thanh toán nhanh, xe đẩy đều còn mới.",shop,8.0,0,0,0,0,0,5
Sản phẩm về mới mỗi ngày! Chính sách đổi trả rất tốt. Nhân viên nhiệt tình. Cửa hàng thân thiện. Nói chung rất là hài lòng về cách phục vụ nv khi cho thử mẫu trái cây và giới thiệu nhiều về các chương trình đang khuyến mãi,shop,9.0,0,0,0,0,0,5
"Buổi tối vào nhà thiếu nhi là rất náo nhiệt. Mấy bé tập võ rất là đông, dạy võ takondo và có cả võ vovinam nữa. Không khí ở nhà thiếu nhi rất vui có nhiều khu trò chơi dành cho nhiều bé khác nhau, rất phù hợp. Mình mà có mấy đứa em còn nhỏ thì xác đinh là sẽ dẫn nó vào đây chơi mỗi khi rãnh rỗi. Vào đây thấy nhiều bé chơi trò chơi mà bé nào mặt mày cũng rất là thấy cưng, giá các trò chơi rất vừa túi tiền. À có cả khu tô tượng dành cho trẻ nữa. Bên trong nhà thiếu nhi còn có khu tranh ảnh những hoạt động của nhà thiếu nhi",travel,8.6,5,0,0,0,0,0
"Vị trí quán nằm đoạn lạc long quân tít bên hồ tây nên là xa trung tâm lắm nhé, đi 1 đoạn mới đến cơ. Tuy nhiên tìm quán khá là dễ vì kiểu quán to đùng rộng trải luôn a. Ko gian bên trong còn rộng nữa, trang trí kiểu truyền thống nên cảm giác khá là hay Giá cả Mẹt 4 người 520k Chất lượng nhìn chung kiểu ăn mấy đồ này thì quán khá là ok a. 1 mẹt cho 4 người ăn có thịt luộc, lòng, rượu mận nói chung cũng khá là đầy đặn. Thịt cảm giác ăn chất mà sạch sẽ nên là ok",foods,7.2,0,0,0,5,0,0
"Mình dẫn bạn ấy đi chơi, xuống nhà hàng nổi Lady Hậu của Victoria ăn bánh ngọt, ngắm cảnh sông Hậu về đêm khá đẹp và lãng mạn nha! Gió sông mát rượi. Chụp hình sống ảo lung linh. Menu bánh Âu chỉ có vài món thôi chứ không đa dạng lắm. Mình gọi phần bánh ngọt và phần kem matcha chocolate. Bánh ngọt làm sẵn để tủ rồi nên mình gọi là người ta mang ra liền. Mình thấy khá ngon, có điều là ngọt quá, nên giảm độ ngọt lại cho giống bánh Âu thì sẽ ngon hơn. Kem thì mau tan lắm nên phải ráng ăn nhanh. Kem trà xanh thì thơm ngon, kem chocolate cũng ngọt nhiều quá. Ăn kèm bánh quy nướng hơi xém. Trang trí trên chiếc thuyền sứ đơn giản. Ở đây dùng dĩa trắng sạch sẽ sang trọng. Nhân viên phục vụ khá ok chu đáo.",travel,7.6,0,0,0,5,0,0
Khuôn viên rộng mà không có nơi cho khách để xe dưới 5 phút. Đi vô đi ra chưa tới 5p là 6k đúng là lm tiền hay thiệt.,travel,6.2,0,0,0,0,0,0
"Lần thứ 3 quay lại nhà hàng. Vẫn phong cách sân vườn vừa độc đáo vừa thơ mộng. Mình cực thích món soup bí đỏ tại nhà hàng luôn, chắc do hợp khẩu vị mình !. Lần nào đến nơi đây cũng được thoả mãn đủ sắc hương vị! Hi vọng lần tới lại có dịp ghé thăm.",wedding,10.0,0,0,5,5,0,0
"Chô, này mình được bạn dẫn đi nè. Bánh canh cua ngon mà nó ăn suốt nhũeng năm đại học. Bánh canh cua chỗ này một tô 25k khá nhiều toPing . Nấm, rồi thịt, cua. Một tô ăn no nê luôn mà rẻ quá chừnb. Nêm nếm ngon nè mà có điều hình như nước lèo không được nóng nên ăn chưa được đã kắm, nếu mà nóng hôi hổi vừa ăn vừa húp nước thì quá đã luôn. Chỗ này còn bán chè bánh plan các kiểu. Trong con hẻm này còn có khá nhiều quán xá đã có mặt trên FOdy, từ từ khám phá hết sau",foods,7.4,0,0,0,5,0,0
"Cứ lễ về là được đám bạn rũ rê đi leo núi do tụi mình được nghĩ sớm nên đi chơi trước hôm lễ 30 tháng 4 chứ đợi đến đó đi thì đứng xếp hàng này nọ và đông cực kỳ nên sẽ cực lắm, thế là cả bọn quyết định đi hôm nay luôn, đi buổi sáng nên không khí nơi này cực kỳ mát mẻ và thoáng, nhiều người cũng đi chùa hành hương này nọ lắm nhe, chùa được xây khá là rộng lớn nhe, kiến trúc nhìn khá là bắt mắt ấy, nhưng lần thứ n rồi rác vẫn 1 đống dù là ngày thường ấy trời",travel,8.0,5,0,0,0,0,0
"Hôm trước đi cùng bạn ghé qua Circle K này, ta nói nó nhiều đồ ghê. 2 chị em lấy 1 ly bò cụng đá bào 12k và 2 cây kem mini. Bò cụng xay đá bào khá ok, 1 ly hoành tráng, mát lạnh nhâm nhi cũng được. Còn lấy thêm kem ăn nữa, cây kem nhỏ xíu, có vị chocolate và vị vani, kem béo, thơm, ăn vui miệng thôu chứ để cho đã phải 5, 6 cây mới đủ. heh. Nhân viên ở đây thân thiện. Mà hình như nhân viên ở đâu cũng thân thiện vậy á. Có dịp sẽ ghé lần nữa",shop,7.8,0,0,0,5,0,0
"Circle không số 54 tô ngọc vân, ngay đoạn ngã rẽ từ đường hồ lên ! Thái độ nhân viên phục vụ khá tốt , tuy nhiên hơi soi mói và tò mò khách hàng một chút bản thân mình thấy thế Khu vực ghế ngồi sạch sẽ và thoáng mát , tuy nhiên thì mình thấy có một điểm trừ là nhân viên dọn đồ hơi lau. Mà kể cả trong việc làm đồ ăn cũng lâu luôn Các mặt hàng được bán khá phong phú và đa dạng Bánh su kem rất rất rất rất rất rất rất tệ . Ăn vừa ngán vừa ngọt vừa chán luôn ạ Cafe thì quá đắng u hu không uống nổi dù monhf đã gọi nhiều sữa Giá ở đây thì đắt hơn các siêu thị khoảng 1 đến 2k Có đồ thì không bị đắt hơn Đc cái ở đây lúc nào cũng fuL bánh báo, thích ơi là thích mà ngon nhất là bánh bao khoai môn",shop,6.8,0,0,0,3,0,0
"Vốn dĩ không thích bánh bao vỏ công nghiệp lắm nhưng mà thấy nhiều người khen bánh bao thọ phát ở hệ thống Circle K khá ok nên là cũng muốn thử. Nói thế nào nhỉ ? Đánh giá khách quan thì bánh bao khá là ok so với giá tiền. Nhân kiểu nạc nạc chứ không mỡ như một số chỗ. Tuy nhiên thì ăn hơi nhạt và không rõ vị gì cả. Vỏ bánh hơi nặng, kiểu bịch bịch ý. Mình ăn không thấy ngon. Nếu so với các hãng bánh bao công nghiệp khác thì cá nhân mình thấy vỏ Thọ Phát không ngon bằng bánh bao Việt Phát hoặc Bảo Lâm. À klq nhưng mà cafe lon của Highland sao chán vậy ? Cảm giác như nước cafe lần thứ 100 .",shop,8.0,0,0,0,5,0,0
"Khu trượt băng nằm ngay tầng 4 dễ nhìn thấy và rộng. Băng thật nên khi trượt khá thích. Giá cho người lớn là 120k cho những ngày trong tuần, 150k cho ngày cuối tuần. Trẻ em dưới 1m40 giá 45k một em. Ngoài ra còn có giá dịch vụ khác như tiền thuê giày, thêu thú vịn khi trượt giá 50 60k. Nếu bạn nào không chơi chỉ vào gần trong sân ngồi chơi thì giá là 20k một người. Lần đầu chơi thấy khá vui và phải thuê thú để vịn , hơi có cảm giác sợ. Tuy nhiên với giá chơi và giá thuê đồ có lẻ chỉ chơi cho biết chứ chơi thường xuyên thì mình thấy giá hơi cao .",entertain,8.0,3,0,0,0,0,0
"Herbal Spa là một trong những lựa chọn tuyệt vời, dành 1 chút thời gian tới đây để thư giãn không có gì là đáng tiếc. Nhân viên nhiệt tình, thân thiện, kĩ thuật viên maSage chăc tay, skiL tốt. Không gian thì thoáng mát, so dễ thương , giá cả hợp lí. Nhất định sẽ ghé thăm lần nữa khi trở lại Đà Nẵng",beauty,10.0,5,0,0,0,0,0
"Lẩu mắm rất ngon, đi 2 người anh chủ quán sẽ cho 1 nồi lẩu vừa ăn, kèm cơm hoặc bún tuỳ yêu cầu của khách. Nồi lẩu mình ăn là 150k do không gọi thêm gì. Rau ăn kèm rất nhiều và tươi xanh, nước lẩu rất vừa ăn, có mực tôm ốc và cá.. Ăn xong còn được tặng kẹo ngậm cho thơm miệng nữa, trà đá frE nha. Quán hơi nhỏ và đông khách, nhưng chủ quán rất hiếu khách và lau dọn rất sạch sẽ.",foods,9.8,0,0,0,5,0,0
"Mình đi đám cưới ban ở đây tận hồi năm 2015, nhưng rất ấn tượng. Nghe đồn thời đó 1 ban đa 8 đến 10 tr, cô dâu chú rể được 1 phòng VIP tân hôn Về không gỉan thi trang trí sanh vô cung snag trọng, bàn đặt khoang cách rộng chứ không chật chội như chỗ khác. Đô ăn nêm nếm ngon,cách trình bay đồ ăn va bàn tiệc vô cùng lọng lẫy. Ngoài ra chỗ này cung có Bq ngon, giá tâm 1tr6 thì phải mình được mời nên không biết giá hI",travel,8.4,0,5,0,5,0,0
"Không gian đẹp. Phong cảnh ở hồ Tà Pạ chính là cái duyên trời cho, 1 vẻ đẹp do con người tạo nên được thiên nhiên ưu ái làm nó trở lên xinh đẹp. Nước xa xa màu xanh đẹp ngất. những mỏm đá khai thác dang dở tạo nên vẻ hoang sơ cho nơi này. Đường đi thì hơi khác so với chỉ dẫn bạn nên hỏi ngưoi dân là hồ gân chùa à lên núi hay mỏm khai thác đá cũ thì nguoi ta chỉ cho à. Người dân ở đây de thuong lắm luôn.",travel,7.6,5,0,0,0,0,0
Cho mình xin số điện thoại ở nhà hàng với được không.mình dẫn đoàn du lịch,wedding,5.4,0,0,0,0,4,0
"Đây là một địa điểm đáng để đi tham quan của Đà Nẵng, nằm cách khu bãi biển của Đà Nẵng không xa lắm, trên đường đi Hội An nên bọn mình có ghé vào chút. Ở đây có 18 tầng địa ngục, với những hình ảnh mô tả làm việc xấu gì thì khi xuống địa ngục sẽ chịu hình phạt ra sao. Tụi mình cứ nghĩ là đi xuống sâu lắm, nhưng thấy đi 1 chút là hết rồi. Trong đó có 1 lối đi lên cổng trời nữa, cầu thang khá dốc và khó đi, nên cả lũ bám vào nhau để đi cho chắc, lối ra có 1 toà tháp khá đẹp. Muốn đi lên chùa thì có thể đi thang bộ hoặc thang máy giá 20k 1 lần cho 1 người. Lối đi lên ngắn tý thôi, nhưng có thể đi thang máy để nhìn ngắm vẻ đẹp của Đà Nẵng qua đó. Ở đó có bán thêm đồ lưu niệm xinh xắn về làm quà. Khuyên các bạn nên mua ở mấy cửa hàng to to, bên tay phải đường theo hướng đi lên chùa, vì mình thấy giá cả rất phải chăng và mấy chị bán hàng nhiệt tình, thân thiện.",travel,7.6,4,0,0,0,0,0
Từng đi ăn buFet dạg gọi món ở squa one tằng trên của KS part hyaT Còn opera chuyên món ý và buFet củg đồ ăn ý nên không pít nên thử không 1 vé là 980k mà không có gan ngỗg hay tôm hùm và chủ đạo là món ý. Nhưg bánh và kem nơi đây rất ngon nhé .,wedding,8.0,0,0,0,4,0,0
"Chỗ này ai ở Sa Đéc cũng đều biết. Bán đồ ăn vặt, đồ ăn sáng gì gì cũng có, bán hơn chục năm rồi, phải nói là món gì cũng có mà giá thì vô cùng học sinh luôn. Vì giá bèo nên quán rất đông, người lớn trẻ nhỏ gì cũng có. Quán nhỏ, bàn ghế ngồi khá chật, theo mình thì quán khá dơ, rác ít khi thấy dọn, khăn giấy dưới chân rất nhiều, bếp nhìn vào rất dơ. Nói chung là ham rẻ thì cứ thử đến 1 lần cho biết.",foods,5.0,0,0,0,3,0,0
"RẤT TỆ. Đến quán vào lúc 9h10 đêm. Mì cay chỉ đúng vị của muối, không nghe tí chua hay ngọt. Thực sự không nói quá nếu bảo dở hơn cả Hảo Hảostar star star Thấy mọi người review tốt, trời mưa lâm râm lội đi 9 cây số tìm quán trong hẻm. Ai dè phí tiền. Thử cho biết, sẽ không ghé nữa. View quán trang trí đẹp, có sách, gấu bông nhưng bù cái đồ ăn không ổn. Trà sữa truyền thống cũng tạm. Chưa kể vừa vào nhân viên liền nhắc 10h đóng cửa.",foods,3.0,0,0,0,1,0,0
"Mình là đứa cực kì đạo bún bò nên vị vậy mình đã ăn rất nhiều quán mà vẫn chưa ưng được quán nào cho đến khi tìm ra quán này. Vô tình hôm ấy mình ở chỗ làm đói dã man mà lại thèm bún bò chỗ mình hay ăn thì xa mà dạo này lại khó chịu nên kiếm chỗ khác ai dè lại tìm ra quán này. Thoạt đầu mình nghĩ quán nhìn view chán cơ mà ăn thử xem sao. Ai dè vào ăn xong mê mẩn luôn, đúng là tốt gỗ hơn tốt nước sơn, vị bò không quá nồng, nước dùng rất đậm đà, thơm dã man. Nói chung là ngon kinh khủng ăn xong rồi vẫn còn ghiền vị này thế là cứ đều đều tới đây mỗi ngày Cách đây hai ngày mình có dắt bạn mình ghé quán ăn thử, bạn mình cũng khen nức mũi. Mình thấy tô 30k là no căng luôn rồi vậy mà hôm đó nghe bạn dụ thế là ăn tô 50k gân quá trời. Bạn mình khen móng giò ở đây rất béo, mềm tan chứ không bị cứng. Nói chung m.ng ăn thử nha đồ ăn nhiều lắm nên giá cả bình dân, cực kì xứng đáng.",foods,9.0,0,0,0,5,0,0
bữa mình ghé qua mua thuốc hai lần rồi ở đây bán thuốc giá cao hơn chổ khác gấp đôi. bữa đó mình mua thuốc ở đây trên bao thuốc ghi là hàng khuyến mãi cấm bán mà cô bán thuốc mang ra bán. rồi năm sản xuất là 2010 mới đâu... mấy bạn né tiệm này ra nha. y đức gì mà thức đức dễ sợ.,beauty,1.0,0,0,0,0,0,0
"Vé vào cổng 50k người, có nhiều khu vực chụp hình đẹp.",wedding,8.4,5,0,0,0,0,0
"Gia đình đi ở đây hơn 5 lần rồi vì rất ấn tượng với phong cách phục vụ của VinPearl. D ồ ăn buFet ngon , phòng và view đẹp , rất gần biển, shuTle và phà đưa đón khách 24 7 nên đi ra Nha Trang chơi đêm khuya về không sợ. Mặc dù về chất lượng công viên của Vinpearl, công viên nước mình thấy vẫn chưa đặc sắc và nổi trội , nhưng với cách phục vụ tận tình thì vẫn đáng là nơi để ghé tham quan lại",travel,8.4,0,5,0,5,0,0
"Địa điểm mới cho các bạn trẻ ở Nghệ An Hà Tĩnh nè, tha hồ check in sống ảo với rất nhiều view đẹp, hải sản ở quá chi là ngon luôn. Gia đình mà có con nhỏ thì không phải lo con không co chỗ chơi đâu nha, ở đây có khu vui chơi riêng dành cho trẻ em. Tóm lại là một địa điểm nên đến trong hè này đó mọi người ạ",travel,10.0,5,0,0,5,0,0
"Chẳng còn bao lâu nữa là tới tết rồi. Mình có tìm địa điểm để mua rượu để làm quà với mang về quê để trưng tết, nên tìm ra được chỗ này đây. Chỗ này mính thấy bán rượu uy tín, chất lượng. Không lo rượu nhái rượu dởm. Đa dạng mẫu mã. Nhân viên tư vấn cũng nhiệt tình. Giá thì tuỳ loại.",shop,8.0,0,0,0,0,0,5
"Với giá 29k mà được dĩa mỳ ý tuyệt vời. Mỳ ở đây khá nhiều, vị thơm ngon, mỳ không bị mùi bột nặng. Mình có gọi thêm món mỳ ý bò bằm ăn kèm với trứng Scotch EG đặc biệt của quán 59k , mình thì thấy thịt của scotch eG hơi bị khô, ăn nhiều hơi ngán, trứng lòng đào thị tuyệt vời. Nhưng kết hợp giữa mỳ và trứng dường như không thích hợp cho lắm. Điều mình yêu thích ở quán là đội ngũ nhân viên đáng yêu, dễ thương và nhiệt tình. Đây là điểm cộng cực lớn để kéo mình quay lại quán.",foods,8.4,0,0,0,5,0,0
"Bao nhiêu năm chẳng qua đây ăn rùi ý . Quán bánh cuốn bún chả nằm trên phố Phạm Hồng Thái, mình chẳng mấy khi ăn bánh cuốn ở đây mà chỉ ăn bún chả thui. Bún chả ở đây đúng kiểu bún chả người Hải Dương từ xưa đến nay vẫn hay ăn, chỉ có chả miếng và được bỏ chung với bún chứ không bỏ thẳng vào nước chấm như trên Hà Nội. Nước chấm vừa miệng, rau sạch sẽ, chả ướp đậm đà. Nói chung sáng dậy sớm mà qua đây ăn thì quá ngon rồi, sợ không dậy được thui Giá 20 30K suất nhé.",foods,7.4,0,0,0,5,0,0
"Chỗ này bán bánh hot dog và bánh flan ngon nhất ở ninh hoà. Địa điểm gần ngay chợ ninh hoà lun... Có ban súp cua nưa ... Mở lúc 2h chiều khoảng 7h30 hết... Hot dog ăn miếng tan chảy pho mai cực thích... Giá bánh flan là 8k, hot dog 6k so với mặt bằng chung ở ninh hoà cung ok....",foods,7.0,0,0,0,5,0,5
"Bánh Tráng Cô Bình Bánh Tráng Cô Bình bán cũng khá là lâu rồi.Chỗ cô bán khá là nhiều món ăn vặt thêm như là khô gà, khô mực,nui chiên,...Cô bán xinh đẹp sạch sẽ,bày bán nhìn khá là hấp dẫn. Vị trí dễ tìm nằm trên đường Trần Hầu. Không gian chỉ bán đi, bày bán đẹp mắt, sạch sẽ, gọn gàn. Giá giá rẽ, khõi bàn, giá học sinh sinh viên. Chất lượng độ ngon thì quá tuyệt, đặc biệt là có nhiều loại nước sốt ăn lạ ngon. Cô chủ bán dễ thương, vui vẻ, thân thiện. Menu có nhiều món tha hồ lựa chọn. Về Hà Tiên lần nào cũng phải ăn .",foods,8.0,0,0,0,5,0,0
