review,category,score,vui chơi,lưu trú,nhà hàng,ăn uống,vận chuyển,mua sắm
"Sau khi về đến nhà, việc đầu tiên mình làm là viết ngay review cho The Muse House Đà Lạt Ngôi nhà Nàng thơ” này có thiết kế rất đẹp và ấm áp, yên tĩnh. Ở dưới là một quán coFE nhỏ và phía trên sẽ là hostel Mình ở phòng đôi, hết 4 ngày 3 đêm và tổng giá tiền only 1200k cho 3 người, còn có đồ ăn sáng frE, thật sự quá rẻ Bước vào phòng ấn tượng với mình nhất là quá đẹp, chăn rất êm và mềm, vệ sinh sạch sẽ và đặc biệt mọi đồ trang trí đều là handmade Ngoài ra mình còn thấy phòng dorm cho những bạn đi nhóm nữa Nhân viên các chị ở đây đều thân thiện và dễ thương, do nước nóng phòng mình thỉnh thoảng có vấn đề nên mấy chị trực phòng chỉnh nước nóng Còn về break nhanh , ở đây có toast, pancake, omeleTe và mì gói. Do đi 4 ngày nên mình đã try hết đồ ở đây Thích nhất là toast, bánh mì nóng giòn nướng cùng với chuối và phủ 1 lớp ciNamon powder Ngoài ra còn có nước uống, cofE, trà và ice blended, mình thì thử Earl Grey Tea, thật sự là rất ngon và còn cho cOkies ăn kèm Mọi thứ đều tuyệt vờI 10 10 Mình sẽ giới thiệu bạn bè và tới đây mỗi khi đến Đà Lạt",travel,9.6,0,5,0,5,0,0
Phục vụ quá kém. Gọi món ngồi chờ hơn 30 không dọn được chén đũa gì cho khách. Đem lộn thức ăn. Phải hối thúc mới đem ra. Cơm chiên tỏi có phần cơm rang giòn bỏ vô bị ỉu chẳng giòn tí nào. Giá cả thì mắc. Nói chung nhìn hoành tráng nhưng phục vụ tệ. Ko bao giờ ghé lại,foods,3.4,0,0,0,0,0,0
"Cuối tuần,mình được bạn dắt đi nhà hàng này, nhà hàng này nằm ngay trung tâm quận 1, mình nghe nói nhà hàng khách sạn này cổ nhất thì phải. Nhìn chung nhà hàng này khá sang trọng, trang trí không gian kiểu kiến trúc cổ Pháp theo mình cảm nhận thôi nhe . Mình rất thích view ở đây. Thức ăn cũng tạm ổn, cách bày trí nhìn cầu kỳ, đẹp. Phong cách phục vụ chuyên nghiệp, nhã nhặn cũng tận tình nữa. Nhà hàng này chắc sẽ là nơi lý tưởng để tổ chức tiệc cưới. Nếu có cơ hội sẽ quay lại.",wedding,7.0,0,0,5,5,0,0
"Tiệc cưới ở đây khá tuyệt D Đồ ăn trang trí khá sang trọng , nhìn bắt mắt mà còn ngon nữa, âm thanh thì khá hay D",wedding,8.8,4,0,5,0,0,0
"Mình đã từng ăn nhiều quán, nhưng những món bò ở đây là gây ấn tượng với mình nhất, đặc biệt là lẩu bò rất vừa ăn, nêm nếm hợp khẩu vị, có vị ngọt thanh của xương bò. Các món nướng ăn kèm với cơm chiên tỏi rất phù hợp. Ngoài ra, phục vụ rất nhanh gọn, các món ăn kèm giá bình dân. Lần sau về châu đốc nhất định sẽ quay lại.",foods,8.2,0,0,0,5,0,0
"Thấy review tốt nên ăn thử, bánh tươi ngon, mềm, thơm sầu, ăn vừa miệng",foods,9.0,0,0,0,5,0,0
"Ăn quá ngon luôn đó tr ơi. Ăn mà không kịp chụp lại để fEdback cho cửa hàng luôn , chủ quán nhiệt tình lắm đó mn",foods,10.0,0,0,0,5,0,0
" Vị trí Quán nằm trên đường NguyễN SơN quận TâN Phú, đi từ LũY báN bícH vô thì nằm bên tay phải. Mặt tiền quán khá hoành tráng, cũng dễ nhận ra vì đường này không nhiều hàng quán to bự.  Gửi xe trước quán có người trông nha, miễn phí Không gian rộng rãi, như các chi nhánh đúng chuẩn khác của icOl, mấy tầng lầu phía trên, mỗi tầng 3 4 phòng, chia loại phòng thường và vip, phòng rộng và nhỏ 🧁 ngoài tiền phòng tính theo giờ ka thì menu có đầy đủ nước ngọt, bia, thức ăn nhẹ, ăn no, lẩu, trái cây đồ luôn.tầm giá thì dĩ nhiên cao hơn bên ngoài, có chia thành các combo tuỳ theo số lượng người nên chia ra cũng không mắc lắm đâu. Chất lượng phòng kara ngon lành. Đồ ăn có lẩu với hải sản sốt mayo ngon cực kì, màu vàng ươm đẹp mắt Nhân viên rất lễ phép và chuyên nghiệp, cúi chào khách đàng hoàng",entertain,8.0,0,0,5,5,0,0
"InterContinental thì là nơi sang chảnh bật nhất ở Nha Trang rồi. Mình rất thích không gian ở đây, mặc dù là ở trong nhà nhưng vẫn thấy rất thoáng đãng, sáng sủa, à ánh sáng ở đây lên hình rất là đẹp luôn đó . Hôm nay mình đến đây ăn sáng chỉ gọi mỗi Bánh mì Việt Nam 60k một phần cũng để muốn thử xem bánh mì ở mấy nơi hạng sang như thế này thì người ta sẽ làm sao. Phần nhân trong bánh mì khá đầy đặn, màu sắc trông cũng hài hoà. Nhân gồm thịt nguội, thịt nướng, đồ chua, dưa leo, chả lụa, rau thơm và nước sốt thịt. Bánh mì cắn ngập răng luôn, hương vị rất hài hoà với nhau. Lần sau mình sẽ còn đến thử các món khác nữa.",travel,8.8,0,0,0,5,0,0
"Trước đó mình tới bãi dài rồi mà chỗ này biển động, không cho bơi nên chạy lại Dốc Lết. Mình đi trong khu của resort nên tính phí 30k người, mà có tắm nước ngọt này kia luôn nên cũng ok. Biển sạch, có chỗ ngồi đàng hoàng, có cho thuê banh này kia xuống biển chơi mà hơi mắc, mình thuê banh 25k tiếng. Bữa mình đi trời thoáng đãng không mưa nên chơi cũng sướng lắm. Sóng hơi mạnh nhưng không tới nỗi. Ăn ở đây thì mình thấy tương đối ok, 23 người ăn đâu gần 4tr, có ghẹ, cơm, cá bớt, lẩu cá cờ, thịt kho, cũng no lắm.",travel,6.8,4,5,0,4,0,0
"Hè này mình co dịp quay lại đây. Ở đây phải nói là quá đẹp, quá văn minh. Cả nhà mình đi du lịch hè, dù đi lần t2 rồi vẫn thấy đẹp, mà chưa đi hết tất cả được rộng và mõi quá! Mùa hè nên rất đông khách du lịch nhưng tuyệt nhiên không thấy rác ở bất cứ đâu hơn nữa 1 điều mình khá ấn tượng ở ĐN là phòng vệ sinh công cộng rất sạch sẽ và vệ sinh. Mình vẫn muốn quay lại nếu có dịp đi ĐN",travel,9.2,5,0,0,0,0,0
H,foods,5.0,0,0,0,0,0,0
"Mình học ở trường và nhiều lần đi ngang qua căn tin và có đôi lần ngồi ăn. Mình thấy ở đây sạch sẽ, thoáng mát và rộng rãi. Đồ ăn, đồ uống cũng phong phú và mình nghĩ chất lượng cũng như vấn đề vệ sinh cũng đỡ hơn là mấy quán vỉa hè, lề đường ngoài trường.",edu,8.0,0,0,0,4,0,0
"Không gian ok, đồ ăn giá cả hợp lý. Về cơ bản, mình khá thích điểm 24hrs Tuy nhiên vào tối hôm mình đi đông và ồn kinh khủng .",shop,10.0,0,0,0,4,0,0
"Vì không có chìa khoá vào nhà nên mình phải ở tạm một đêm. Nhìn chung, phòng ở cũng khá, tuy nhiên khá cũ, làm thủ tục nhận phòng nhanh và thuận lợi. Khách sạn là 3 sao thôi, nên trong phòng không có đồ đạc gì hiện đại, đèn ngủ sáng quá, phòng tắm rộng rãi, có một cái mình không thích là thang máy của khách sạn khá chậm và phải chờ lâu. Điều thích nhất ở khách sạn này là đồ ăn sáng ở đây phong phú, rất vừa miệng, phở ở đây ngon xuất sắc luôn, mình thấy còn ngon hơn ở quán phở. Mình mong là sẽ được ăn bữa sáng ở đây lần nữa.",travel,7.2,0,4,0,4,0,0
Lần đầu vô quán. Bất ngờ vì menu khá đắt. Nhưng ăn xong thì thấy rất đáng đồng tiền luôn. Mấy bạn phục vụ cũng rất nhiệt tình.,wedding,7.8,0,0,0,5,0,0
"Mới đi ăn đám cưới chị bạn về, lần đầu tiên mình tới đây ăn cưới, không gian ổn, đồ ăn ở đây ăn ngon, rất vừa miệng dễ ăn mà còn nhiều, lần đầu đi ăn đám cưới mà no quá trời",wedding,7.8,0,0,5,5,0,0
"Sáng nay ghé ăn sáng nhưng mang thiếu tiền, chị chủ vẫn vui vẻ cho nợ, đồ ăn rất ngon, thích hợp cho những gia đình ghé ăn",foods,10.0,0,0,0,4,0,0
"Đảo Nam Du du khách đi riết cũng chán nên giờ người ta tổ chức tour mới ra các đảo khác ở Kiên Giang và đảo Hải Tặc là một trong số đó. Hoang sơ hơn cả Nam Du, thiết bị gì cũng thô sơ và thiếu thốn đủ thứ, quần đảo này còn phải được đầu tư phát triển hơn nữa mới hút khách như Nam Du được. Nước biển không được trong lắm nhưng khá sạch. Đi buổi trưa mà có nắng là gió nóng thổi vào khó chịu vô cùng. Hình chụp lên cũng không mấy lung linh",travel,7.2,3,0,0,0,0,0
"Khách sạn có vị trí trung tâm. Cách các địa điểm nổi tiếng như chợ đêm, phố đi bộ, tháp Trầm hương chỉ 1 5 phút đi bộ. Điều nổi bật là tầng 41 có Skylight chụp ảnh siêu đẹp. Nếu đi cùng trẻ nhỏ còn có đường hầm nối biển đi thẳng từ khách sạn ra bãi biển riêng. Khách sạn 5star nhưng giá rất phải chăng chirt từ 100 đã bao gồm thuế phí và ăn sáng tuyệt đỉnh. Một địa điểm đáng thử khi nghỉ tại Nha Trang. havanahotel hotelsiNhatrang BuFet nhatrang skylightnhatrang",travel,10.0,0,5,0,0,0,0
"Bên này nổi tiếng trong giới make up lắm, vì thấy toàn make up cho event của người nổi tiếng ở đà nẵng như hoàng thuỳ, lan khuê,.. sắp tới có cuộc thi hoa hậu đại sứ du lịch ở hội an, bên này cũng make up lun đó, vậy nên chắc đủ hiểu trình độ, uy tín châts lượng như thế nào nên mới được make up cho cuộc thi lớn như vậy á nha",wedding,7.8,0,0,0,0,0,0
"Có tổ chức sn ở đây cho 16 người nhưng phòng bOk hơi chật do hết phòng nên ngồi sát không được thoải mái. Bù lại đồ ăn rất ngon, sườn sốt chua ngọt chắc là ngon nhất, dĩa trái cây to đùng. Buổi tối cuối tuần thấy đông nghẹt, fuL hết bàn",wedding,7.8,0,0,0,4,0,0
"Đồ ăn nấu đậm chất Trung Hoa, rất ngon. Món vịt quay Bắc Kinh siêu ngon và thơm mùi nước sốt thịt vịt khá mềm sau đấy được đem đi làm các món khác cũng hấp dẫn không kém. Phong cách trang trí nhà hàng khá ổn, có không gian phục vụ rất nhiệt tình. Điểm trừ duy nhất là món ăn ở đây khá đắt so với những nhà hàng TQ khác mình đã tới",wedding,6.8,0,0,0,4,0,0
"Quán trang trí rất dễ thương, là một nơi lý tưởng để ngắm hoàng hôn và thư giãn. Quán mở nhạc rất hợp gout của mình nên mỗi lần tới quán đều ngồi quên cả thời gian Nhân viên phục vụ chuyên nghiệp, thân thiện. Sẽ quay lại nhiều nhiều",entertain,9.6,4,0,0,0,0,0
"Khách sạn này nằm ngay chợ đêm Đà Lạt í, nên rất tiện cho nhu cầu đi lại, mua sắm của những ai thích shoPing như mình hén. Mình đi Đà Lạt cũng nhiều rồi, nhưng đa số là đi công tác, không có thời gian dạo chơi khu vực ăn vặt. Kỳ này tự bOk vé đi chơi, nên chắc chắn phải chọn khách sạn nào gần chỗ ăn chơi . Phòng ở Royal sang trọng, ấm cúng. Nhìn từ bên ngoài rất đúng với cái tên Royal của nó. Phòng đầy đủ tiện nghi, máy nước nóng lạnh luôn nhé. Chắc chắn mình sẽ còn ghé lại!",travel,8.0,0,5,0,0,0,0
"Thật tuyệt vời, dịch vụ đa dạng, không gian sang trọng, nhân viên rất nhiệt tình.",beauty,10.0,4,0,0,0,0,0
"⛳ Vị trí Đẹp miễn chê luôn. Ở gần với Hồ Tây. Rẽ vào một con đường rộng rãi và tách lập với phố phường. View mọi hướng đều nhìn ra hồ, thơ mộng, nhẹ nhàng và bình yên vào sáng hay lung linh ánh sáng vào tối.  Không gian rộng vô cùng và không giống kiểu khách sạn thông thường. Đây như một tổ hợp luôn ý. Với những kiểu giống biệt thự tạo thành. Thích nhất là có chỗ nhà ngay trên mặt hồ đẹp mê ly cùng với con đường trải dài cùng hàng cây. Cách trang trí đơn giản, sang trọng  Và khách sạn ở đây hay tổ chức hội họp, hội thảo lắm.  BuFet ở đây thì ngon rồi, chất lượng miễn chê. Từ hải sản tươi ngon, sushi, rau củ, các loại gỏi,... Đến các món tráng miệng trang trí đẹp mắt và chất lượng cũng tốt.  Buổi chiều có tiệc trà nữa bánh hay trà, cafe đều rất ổn.  Chất lượng dịch vụ tốt từ thái độ, cách phục vụ của nhân viên chuyên nghiệp. Điểm trừ nhỏ là điều hoà mát phát lạnh có kiến nghị bảo giảm bớt mà vẫn lạnh quá trời  Ngoài ra khách sạn còn có bể bơi ngoài trời và bar bủng nữa",travel,8.2,0,5,0,5,0,0
Đồ ăn nấu vừa miệng. Thực phẩm tươi ngon. Giống như ăn ở nhà,foods,7.4,0,0,0,5,0,0
"Thiên đường nghỉ dưỡng là đây. Đến Nha Trang mà không đến nơi này quả là thiếu sót. Mọi thứ đều đẹp, sạch sẽ. Nhà hàng sang trọng, bể bơi lúc nào cũng xanh và sạch. Đứng từ trên ngóng ra biển thì quá đã. Muốn ở mãi không về.",wedding,8.0,5,5,0,0,0,0
"Không thu phí tham quan. Người lớn thường dắt con trẻ vào đây chơi. Trong này rộng rãi lắm. Còn thanh niên đa phần ùn ùn về khu sân khấu để chụp hình. Mình thấy rác nhiều quá, rác lớn công trình chứ không phải rác thải sinh hoạt. Chụp hình phải né mấy mớ rác ra. Ai mê chụp hình thì vào đây mần 1 tiếng là được cả shot hình dài chứ chẳng chơi. D",service,6.6,1,0,0,0,0,0
"I don t often write review for service on internet but today I m here and I am gì ust now reviewing this sản phẩm a! I have found it on Tripadvisor, then made a bOking via phone and went there in a wEkend afternOn. NormaLy, you would nEd to bOk your thời gian a few days in advance however, they were haPy to take my bOking in the same day because I traveLed in Da Nang for 3 days and didn t have much thời gian . I decided to give Spa MiS Gia Han try and I reaLy did en gì oy it. I have to say this is a plus for them to compare with other places. Their pricing is gOd tO. If you quá nhắn tin to reaLy sản phẩm oil yourself after a long wEk of travel, I recoMend you to check out this place. En gì oy!",beauty,10.0,0,0,0,0,0,0
"Từ ngày đi làm qua cây cầu mới biết ăn sáng là gì . Mỗi ngày một món ngon khắp phố phường Hạ Long, biết thêm nhiều quán hơn, nhiều quán ngon bá cháy luôn mà sao giờ t mới biết cơ chứ. Nay được đi ăn xôi ở Phố Thương Mại, đến nhìn mọi người làm chả mực tay nhanh thoăn thoắt sướng. Chị chủ quán cắt tóc ngắn nhìn dễ thương thế không biết, giọng hay nữa a . 25k đĩa gồm xôi và 2 miếng chả mực mà ăn no căng luôn. Nhiều xôi cơ mà t thích ăn xôi mềm chút, xôi đây hơi khô so với khẩu vị . Chả mực ngon luôn nhé, ngon hơn ở chỗ ăn bánh cuốn bà ngân cơ, cắn là thấy mực luôn rồi. Miếng xôi miếng chả ngập miệng luôn Giá cả ok , chất lượng tốt, quán mến khách, mọi người thích thú, thế là ok , ok lắm luôn . Có dịp đến Hạ long thì ăn thử ở đây đi các bạn ạ!",foods,7.8,0,0,0,5,0,0
Lại đến nữa,foods,8.4,0,0,0,0,0,1
"Vé hơi cao, 100 mấy không cho một người, mình toàn nhận được vé mời. Những lời trước đi xem kich mới thấy thể loại kịch sân khấu nó phát triển tới cỡ nào. Cười giật mình cứ như đang xem phim 3D, âm thanh ánh sáng quá hoàn hảo Điểm trừ là đợt vé tuần này là tối thứ 5. Mình cùng gia đình ra thì bảo huỷ kịch dời thứ 6... Đành về Qua thứ 6 lại 1 lần bảo huỷ kịch dời qua tối thứ 7... Thiệt là hơi nản",entertain,6.4,4,0,0,0,0,0
Xứng đáng với chất lượng Bún Hải Sản Hạ Long. ngon tuyệt vời,foods,8.2,0,0,0,5,0,0
"Lần đầu ăn trưa sang chảnh đến như vậy . Lên tầng cao, ngồi ăn trước cửa kính nhìn xuống phía dưới với xung quanh thế này nhìn rất thích. Xung quanh khách sạn bây giờ do có nhiều khách sạn đang xây nên tầm nhìn hơi bị hạn chế vì toàn là lô cốt. Đồ ăn ngon, rất vừa ăn, không gian sang trọng, thoáng mát. Nói chung mình rất ấn tượng với khu nhà hàng của khách sạn. Vì là khách sạn 4 sao nên không chê vào đâu được. Sẽ quay lại khi có thời gian",travel,9.0,0,5,0,5,0,0
"Mùa này đi biển thật tuyệt vời , ở saigon nóng bao nhiêu, thì ở biển mát bấy nhiêu, nắng nhưng biển rất êm và trong xanh mát rượi , thật tuyệt vời kaka",travel,8.6,5,0,0,0,0,0
Mới ghé luôn. Zk ck mình ưng ý lắm. Hẹn gặp Lava 1 ngày không xa,foods,7.8,0,0,0,5,0,0
"Quán cũng dễ tìm lắm nha, không xa trung tâm ĐL mấy cái đẹp nhất là cái view. Ít khi có chỗ nào mình thấy cái view vầy. Nước bọn mìn kêu aFogato, thì cho 1 cục kem với 1 shot cafe để ngoài, đậm luôn. Caramel machiato và choco lạnh, làm đẹp, mà cũng tạm tạm hà, bánh croiSant với danish nho ngon, làm nóng lại giòn. Để xe trước tiệm. Trang trí trong quán xinh lắm, nhiều góc cho mấy bạn chụp choẹt. Mà đi đây t6 chứ không bị đông quá nha, thư giãn ngồi được nè.",travel,7.0,0,0,0,5,0,0
"Giá cả phải chăng, nhân viên tư vấn nhiệt tình",wedding,6.2,0,0,0,0,0,0
"Quán khá đông vào buổi sáng và trưa, màu sắc đẹp, thành phần phong phú... Giá phải chăng khoảng 40k bát phù hợp cho bữa ăn trưa nhẹ nhàng với bạn gái trai hoặc với bạn bè.",foods,6.0,0,0,0,4,0,0
"Đi ăn xong về sớm nên ghé đây hát karaoke, mình đến quán khá sớm nên không đông khách lắm. Phòng nhỏ, âm thanh tốt nhưng vệ sinh không được sạch sẽ lắm. Phòng mình ngồi ghế cao hơn bàn khá nhiều nên hơi khó chịu. Phục vụ cũng không được thân thiện lắm. Cách âm giữa các phòng không tốt, ngồi phòng này là nghe được phòng khác hát. Bọn mình hát khoảng 1h30, đi 4 người, uống vài lon bia và nước ngọt, đến khi thanh toán hết 232k.",entertain,7.0,0,0,0,3,0,0
"Thấy có dịch vụ Now giặt giao tận nơi nên sẵn có đóng đồ dơ bOk giặt thử. Mình bOk khoản 15 20p là có người tới nhận đồ và khoảng 4h sau thì giao. Đồ giặt sạch, thơm và sếp khá gọn gàng. Phí giao hàng khá rẽ. Thích hợp cho những người không có không gian phơi đồ vào mùa mưa như thế này. Vừa khoẻ vừa nhanh vừa có đồ đẹp đi làm",service,7.4,0,0,0,0,0,5
"Phục vụ tốt, giá cả hợp lý chổ đậu xe an toàn",foods,7.0,0,0,0,0,4,0
"Đợt trc 20 10 fai chụp ké hoa của 1 chị ở Cty, xong về nhà đã thấy mùnh được 1 lẵng hoa to đùng rùI Hoá ra là bạn mình đã đặt mua sẵn ở đây mang về Hoa lẵng này thiết kế khá lịch sự, trang nhã mà màu sắc cx tươi tắn nữa. Hoa để chơi được rất lâu cỡ gần 1 tuần cơ mà  Giá hoa thì mình không rõ nhg mình đoán là cx mắc vì dịp đó là dịp 20 10 nên auto là rất đắt và cháy hàng rất nhanh ",wedding,7.2,0,0,0,0,0,5
"Chất lượng phục vụ ok. Nhân viên xinh xắn. Bỏng ngon hơn hẳn các rạp khác, giá vé hợp lý, rẻ. Nhiều khu check in đẹp nữa.",entertain,8.0,4,0,0,0,0,0
"Dâu sạch, ngon, vườn dâu thoáng đãng sạch sẽ, Cô chú chủ vườn dâu thân thiện nhiêt tình",travel,8.2,0,0,0,5,0,0
"Không gian rộng, đẹp, thoáng mát, nhiều nơi khám phá. Bạn không cần phải đến vườn hoa trung tâm hay đi đâu đó xa xôi để có những tấm ảnh rất Đà Lạt. Nhưng vị trí hơi xa trung tâm, mất khoảng 40k tiền taxi để đến trung tâm. Phòng nghỉ sạch sẽ nhưng có phòng bị dột, mình phải chuyển sang phòng khác. Nhưng nhìn chung mình thấy ở đây khá ok, thích hợp với người thích yên tĩnh, nghỉ dưỡng.",wedding,8.0,0,5,0,0,0,0
"Thời gian dài mình có cơ hội tiếp xúc với khách sạn HyaT, do học ngành liên quan, nên cũng có cơ hội được nếm đến các món ăn nơi này. Mỳ Ý và PiZa ở đây ngon! Cá chẽm với cá hồi đút lò cũng ngon hết sảy lun, đúng chất 5star . Soup hải sản thì khỏi nói, toàn hải sản chất lượng, toàn hải sản mập ú không Salad thì mình gợi ý mọi người nên ăn Chef salad, món đặc trưng của Opera đó, ngon lắm. Ko hiểu sao chỉ với giấm và dầu olive, cùng vài gia vị phụ mà đầu bếp có thể làm ra vị salad đặc trưng và ngon đến vậy. Món ngon được khuyên nên chọn nữa đó là bò Mỹ sirloin, thêm ly Chianti ClaSico nữa là tuyệt lun! BuFet thì có buổi trưa với sáng. Sáng chủ yếu là khách phòng ăn không à, nhưng cũng có cho khách ngoài. Có đầy đủ món dành cho một buổi sáng đầy năng lượng lun. Ngũ cốc, trứng các loại chế biến theo kiểu Tây, cháo, bánh quá Fle, trái cây,... BuFet trưa Chủ Nhật thì toàn hải sản ngon, to không Mình rất thích champange Ý ở đây nữa, ProseCo uống ngọt ngọt, nồng nồng, rất thích hợp cho phái nữ. Ăn kèm hải sản là đúng vị nhứt!",wedding,8.6,0,0,0,5,0,0
"Ding tea ở đây mở sau Dingtea Phạm Ngũ Lão 1 thời gian, mà hồi mới mở vì có khuyến mại nên chẳng bao giờ chen được vào mua . Dingtea Trần Hưng Đạo nằm ngay Tổng hợp Hải Dương, vị trí đắc địa ngồi trên tầng 2 là có thể bao quát trung tâm thành phố, hay ho phết. Đồ uống thì ở ding tea nào cũng vậy cả thui mình nghĩ thế , menu và giá giống hệt nhau. Mình hay gọi Ô long không sữa thêm chân trâu, có 30K cốc mà rõ là ngon luôn mng thử uống không sữa như mình xem sao nhé",foods,7.0,0,0,0,5,0,0
"Quán thoáng mát , thức ăn tươi ngon , nhân viên phục vụ quá nhiệt tình anh chủ vui tính , sẽ ghé khi có dịp ra Hạ Long Bay !",foods,10.0,5,0,5,5,0,0
"Cầu Cần Thơ thì quá nổi tiếng rồi. Nó là một biểu tượng của thành phố Cần Thơ. Mỗi khi đi đâu xa về tới đây là tôi biết mình đã đến nhà, cảm giác rất gần gũi thân thuộc Lâu lâu rảnh rảnh tôi thường chạy lên cầu chơi, hóng gió, chụp vài ảnh đẹp đẹp sống ảo này. Đứng từ trên cầu nhìn ra một bên là thành phố với những ngôi nhà nhỏ nhắn bên dưới, là cồn Ấu xanh tươi, một bên là bờ Vĩnh Long với dải đất trải dài và những khu công nghiệp. Trên cầu gió rất lớn. Nhưng chụp ảnh rất đẹp. Hai trụ chính to và uy nghi. Cùng các cọng dây văng màu đỏ nổi bật. Ban đêm cầu lên đèn còn đẹp hơn nữa",travel,7.8,5,0,0,0,0,0
"Mình ghé quán với mẹ bạn. Bên này nem ngon lắm, tương tự nem nướng Đà Lạt. Thích nhất phần rau sạch nhiều. Phục vụ cực thân thiện chu đáo luôn! Quán sạch sẽ, gần quả ng trường dễ tìm D",foods,7.8,0,0,0,5,0,0
"Đây là 1 trong mấy quán ăn vặt ruột của cả team mình. Mình hay đặt hàng về từ trang giao hàng Now do có nhiều chương trình giảm giá, cứ chiều chiều là lại thèm như 1 thói quen vậy. Ở đây giá cực hợp lý. Suất nộm 20k thôi mà cứ nhiều ú ụ, được trộn đầy đủ loại rau thơm, 2 người ăn vẫn đủ. Nem cuốn, bột lọc cái nào cũng mập, cắn ngập răng. Nước dùng là linh hồn của mấy món này. Chua chua ngọt ngọt dễ ăn vô cùng. Mình thì hay thêm ớt để tăng mùi vị nữa. Chẹp, không biết phải đóng thêm bao nhiêu sưu cho quán này nữa đây",shop,8.6,0,0,0,5,0,0
"Có vẻ như khách đến đây không phải tuýp thích chụp hình đăng lên các phương tiện 4.0. Palace heritage có nhà hàng trên đồi view hồ xuân hương, nhạc công chơi gì aZ trên piano, không gian sang trọng nội thất 5star phục vụ chu đáo khách đông nhưng lịch sự văn minh. Menu đa dạng món ăn việt nam và quốc tế, tráng miệng và đồ uống cầu kỳ. Quán bar dưới tầng đẹp ấm cúng có ca sĩ hát hằng đêm bắt đầu vào 8 rưỡi tối. Đà lạt mùa thu 2018",travel,9.6,0,0,0,5,0,0
