review,category,score,vui chơi,lưu trú,nhà hàng,ăn uống,vận chuyển,mua sắm
"Ghé đây thử , thấy cũng ok . Chủ yếu có bãi đá và ngồi chòi ăn uống. K tắm được nên hơi chán. Ai thích ngắm san hô thuê cano 100k một ng ra lặn . Từ núi linh ứng đi một đoạn tiếp là tới. Thấy chụp hinh cưới nhiều.",travel,8.0,4,0,0,4,0,0
"Cũng chuyển về HĐ 1 thời gian rùi mà số quán ăn ở đây đếm trên đầu ngón tay, tìm được quán bánh tráng trộn vui mừng khôn tả. Bth muốn ăn phải đi xa lắc xa lơ. Quán có bánh tráng trộn, nướng, cuộn. Đồ làm trên 1 cái xe hàng nhưng bên trong lại có không gian ghế ngồi lịch sự, rộng rãi. Thiếu mỗi cái điều hoà là rất tốt bánh tráng đồng giá 20k hết á. Nhìn chung thì bánh tráng trộn khá ok, bánh tráng nướng thì nhiều nhân chấm cùng sốt me đậm đà, bánh tráng cuộn thì mình chưa ưng nhắm, cứ thấy thiếu thiếu gì đó mới ưng được . Nhìn chung thèm thèm thì lại cứ ra đây thui gần nhà mà phục vụ cũng tốt nữa.",foods,7.0,0,0,0,5,0,0
"Mình ghé quán cũng lâu rồi mà giờ mới nhắn vài dòng. Hôm mình tới quán mưa tầm tả may có lúc ngừng mưa là bay ra chụp hình liền, tới quán đầu tiên là sẽ có mấy em cún ra chào đón bạn và theo bạn lúc ra lấy xe luôn nha mình được một em cún theo mà mình chạy xe đi rồi mà vẫn chạy theo mình phải quay lại gọi cho anh nv ra luôn á View ở đây rất đẹp nha mn rất đẹp nhưng mấy cái ghế hơi dơ. Mình cũng gọi 2 nước bình thường h nên hông có gì đặc biệt cả",foods,8.2,0,0,0,5,0,0
"Chùa này mới xây dựng lại được mấy năm nhưng thấy rất là đẹp. View dựa núi mặt hướng biển, chỗ này được rất nhiều du khách lẫn người bản địa ghé qua. Các dịp tết rất đông, muốn ngắm girl xinh thì đầu năm qua đây",travel,8.0,4,0,0,0,0,0
Hiện tại tôi đã có gia đình và sinh sống ở TP HCM . Vì công việc xa nhà mưu sinh nên phải xa nhà. Vợ tôi đang có Bầu nên phải về Quê Qủang Ngãi để dương. Điều buồn nhất với tôi là không chăm sóc vợ tôi khi mang em bé. Được biết ở quả ng ngãi có gà rán . Món vợ tui thích nhất. Nhưng vợ tôi ở khá xa nơi bán. Mong rằng các bạn giúp đở tôi . Giao giúo tôi vài phần gà rán đến nới thay tôi chăm sóc được không ak. Cảm ơn các bạn nhiều. 0932.056.357 tôi tren Ý Nếu có ân huệ nào. Tui xin nhận Cảm ơn các bạn,shop,5.4,0,0,0,3,0,0
"Kiếm chỗ đi tăng 3 mà hỏi toàn 350 450k h không hà, xong tự nhiên được nhân viên mấy quán karaoke chỉ đường cho qua bên Lam Sơn, chỗ này công nhận bao rẻ, hát lúc 2h sáng mà có 120k h còn ban ngày thì 50k, nhân viên tận tình, đi WC mà có người đứng phát giấy cho. Phòng kara ở đây y chui xuống hầm như mê cung vậy đó, hơi tối. Phòng ốc thì cũ, không có nhạc mới đâu nha, âm thanh cũng được. Nhìn chung với giá này không đòi hỏi nhiều, khuya không biết đi đâu thì vô đây quẩy ok, leo lên bàn lên ghê luôn cũng không ai nói gì chứ mấy chỗ khác là nhân viên bay vô kêu ngồi xuống . Gửi xe 3 hay 5k gì đó. Chú gửi xe cũng vui vẻ. Ổn.",entertain,7.4,0,0,0,0,0,0
mỗi lần về qê tớ hay dẫn đứa e đến đây ăn ăn đã nhìu lần rồi nhưng mấy lần trc không chụp hình lại quán có không gian rộng rãi thoáng nhưng hơi nóng vì không có máy lạnh đồ ăn tạm ổn e tớ thích kimbap của quán và mì tương đen nhưng quá n đã không bán mì nữa còn tớ thích phá lấu và dimsum rất ngon lựa chọn tốt ở CL,foods,6.0,0,0,0,4,0,0
"Đi Hạ Long chơi đúng dịp Marine Plaza này mới khai trương nên cũng đi thăm thú cho biết. Hôm mình đi còn có biểu diễn ca nhạc, hát hò, nhưng đông quá không thể xem nổi gì. Trong này có khuôn viên rộng và nhiều cây cối, có hồ, đài phun nước nhìn cũng long lanh. Phần khu mua sắm thời trang chưa có nhiều mấy, toàn mấy cửa hàng quần áo không phải cao cấp, nhìn cứ chán chán thế nào ý. Đồ ăn cũng chả có gì nhiều, hôm thấy mỗi cái LoTeria là sang chảnh nhất ở đây. Hình như bây giờ có thêm cả rạp chiếu phim CGV trong này. Chứ ngày trước đúng là chả có gì luôn.",shop,7.6,1,0,0,0,0,0
"Tôi rất hài lòng về dịch vụ maSage ở đây. Mọi người hãy ghé qua để cảm nhận nhé, nhân viên ở đây rất vui vẻ, nhiệt tình. Giá cả ổn và chất lượng dịch vụ rất ok!",beauty,9.0,5,0,0,0,0,0
Order yogurt mà không bỏ đá ? ? Sao uống ? ? Ko có đá riêng luôn ? ?,foods,2.2,0,0,0,1,0,0
"Quán giải nhiệt dễ thương, có phía ngoài vỉa hè ngồi tám chuyện vui vẻ mát mẻ, tăng giao tiếp chứ ngồi mấy quán sang chảnh là cứ cầm máy checkin thôi. đủ loại kem chè, thức ăn nước uống mùa hè màu mè nhiệt đới. cô chủ quán dthuong lắm nhé",foods,8.0,0,0,0,5,0,0
Đây là lần đầu tiên mình ghé lăng chủ tịch. Do không biết thời gian mở cửa nên đi tầm 4h chiều là bên trong đóng rồi. Chỉ được nhìn từ phía ngoài thôi. Nếu lần sau có dịp quay lại mình nhất định sẽ ghé vào bên trong,travel,8.2,4,0,0,0,0,0
"Nói là nhà hàng nhưng ở đây còn có rất nhiều dịch vụ đi kèm nha, quán hơi khó kiếm một tí nhưng được cái là không gian khá là ưng nè. Không gian khá là sang trọng nè, thích hợp đi gặp mặt hay tổ chức tiệc nha Nhân viên cũng ok nữa Nghe đâu quán mở 24h nhưng không biết có phải không nè, đồ ăn khá ngon nha, tươi nữa, nhìn rất là hấp dẫn luôn, có cả lẩu nữa đó Ở đây ăn theo dạng buFet, một vé là 100k nha, muốn ăn bao nhiêu tuỳ thích nè, ăn no ngồi nghỉ xong ăn tiếp cũng được luôn nha",foods,10.0,0,0,0,5,0,0
Món ăn ngon và không gian siêu tuyệt vời! Ở Hà Nội mô hình này có nhiều nhưng mình không nghĩ ở Nam Định cũng có một nhà hàng đậm chất anh hùng Lương Sơn Bạc như Tửu Lầu Nam Định,foods,10.0,0,0,5,5,0,0
Món ăn ngon và bổ dưỡng,edu,7.8,0,0,0,5,0,0
Góc hẹn hò.,foods,9.0,0,0,0,0,0,0
"Quán cũ kĩ, nhân viên phục vụ thái độ kém. Đồ ăn tạm được tuy nhiên món lẩu mực măng chua không tươi khiến một vài người bị đau bụng. Mình đặt ghẹ được báo giá 650k cỡ 5 6 con không nhưng khi mang ra thì be tẹo, tổng 50 con 5,5 không tức là 9 con kg. Trong khi cùng giá ở Cát Bà là cỡ 3 4 con kg.",wedding,2.8,0,0,0,1,0,0
Thực ra rv quán nhiều lắm rồi nên không định rv thêm đâu nhưng hôm trc đi ăn được khuyến mãi món lặc lày dòi bổ dưỡng nên phải up lên cho mọi ng cẩn thận chú ý. Cũng dễ tính nên không làm ầm lên chỉ nhẹ nhàng nói với nhân viên thôi. Nhưng cả nhà về vẫn hãi lắm vì dòi béo và siêu nhiều.,foods,7.2,0,0,0,5,0,0
"Hình như những công viên văn hoá lúc nào cũng đông khách nên chẳng cần phải phục vụ chi cho tốt nhỉ. Nhân viên locker thì quát khách mặc dù mình dạ thưa rất đàng hoàng, nhân viên bán quầy thuê đồ thì vừa nghe đt vừa chửi thề vừa quăng đồ cho mình bị rớt đất và mình phải tự nhặt lấy.",travel,4.4,0,0,0,0,0,0
Shop trang trí đẹp lắm luôn. Thích nhất là các loại trái cây nhập lạ và tươi ngon. Mình thích nhất là chà là,shop,10.0,0,0,0,0,0,4
"Khi đi du lịch tại Đà Lạt, ăn uống đôi khi sợ bị lầm. Quán ăn cô Minh giữa dốc là quán ăn gia đình tự nấu, đúng gốc người Đà Lạt. Bạn có thể yên tâm về chất lượng và giá bình dân cho dù ngày thường hay ngày Lễ, chỉ là một giá. Hãy ghé và thử thôi.",foods,6.8,0,0,0,5,0,0
"Có 1 lần được mời đi sinh nhật bạn ở đây. Nhìn chung thấy quán rộng rãi, trang trí sang trọng theo phong cách hoàng gia. Nhân viên phục vụ tận tình, phòng hát rộng, âm thanh cũng tốt. Rất thích hợp để tổ chức party với số lượng bạn bè lớn. Do phục vụ chuyên nghiệp và quy mô hoành tráng như thế nên tất nhiên giá cả cũng không rẻ rồi.",entertain,8.0,4,0,0,0,0,0
"Hotel nằm ngay trong lòng phố cổ hà nôi chỉ đi một đoạn là ra tới hồ hoàn kiếm. Bên trong đầy đủ các tiện nghi hiện đại và decor theo phong cách hơi hướng dân gian rất đẹp gần gũi và ấm cúng ạ . Mình thấy đa số là khách châu âu , thì thoảng mới có khách châu á nghỉ tại đây",travel,8.2,0,5,0,0,0,0
"Cực nhiều đồ ăn vặt,bánh kẹo hàn,nước uống siêu ngon,nhìn là đã thích rồi",shop,10.0,0,0,0,4,0,0
"Nhắc đến bò bía bờ hồ Nguyễn Du là phải nhớ ngay tên Bò Bía Mỹ. Quán bò bía này cũng truyền thống lâu đời lắm rồi, không nhớ nó mở khi nào nữa mà từ ngày mình biết ăn bò bía thì đã thấy nó, cũng tầm hơn 10 năm rồi à Không nhớ rõ nữa. Nằm trên khung đường trường Lý Thường Kiệt và khu trung tâm hành chính nên quán này đông khách lắm, nhân viên quán thì cuốn không kịp bán nên nhiều khi cũng phải ngồi đợi hơi lâu. Được cái là bò bía ngon, nóng hỏi kèm với nước tương chấm ở đây là khỏi chê. Giá 1 ngàn 5 trăm đồng một cuốn. Sức mình ăn cở 20 cuốn à D",foods,8.4,0,0,0,5,0,0
"Trưa hay dô đây nghỉ, quán có cơm trưa đồng giá nên ăn thử , cơm trộn bò ngon nè hợp khẩu vị , bạn mình mì cay nó ăn hết rồi nên chưa được thử K , Nước cũng ngon nữa",foods,9.6,0,0,0,4,0,0
"Ngon, không gian ok",shop,8.8,0,0,0,4,0,0
"BuFet ở Quốc Tế ăn khá ngon, và cũng khá phong phú để lụa chọn. Giá cả thì cũng tầm giá thị trường thôi, hôm mình ăn buFet tối giá khoảng 180k người...Về quy cách phục vụ, đây là điểm mà mình ưng ý nhất ở nhà hàng Quốc tế khi mà nhân viên luôn thân thiện và thực hiện các yêu cầu của khách rất nhanh chóng và hợp lý. I wiL be back,guys!",wedding,7.6,0,0,5,5,0,0
"Nghe tên trà tắc thấy là lạ, một thức uống mới tại Đà Nẵng, lần đầu ghé uống thấy ly mình tưởng nước cam hay chanh, khi uống thì vị khác khác, giống như kết hợp giữa trà, chanh và cam Khi nào mà thật là khác, uống 1 ly là tuyệt vời",foods,7.8,0,0,0,5,0,0
Bác sỹ nhiều kinh nghiệm nhất ĐN. Y tá rất nhiệt tình.,beauty,10.0,5,0,0,0,0,0
"Chẳng đẹp như hình quả ng cáo đâu ạ. Vườn dâu nằm trong khu du lịch hồ than thở nên không mất phí tham quan nhưng chỉ có khoảng vài luống cho khách tham quan thôi à. Còn lại cấm hết, treo biển khu vực dành cho nhân viên Dâu ở đây thì không được hái, mà cũng có dâu mà hái đâu. Nhân viên hái hết quả chín rồi. Chỉ còn lèo tèo lại vài trái xanh bé xíu. Với cả chậu dâu nhìn cũng hẻo, ít lá, thưa thớt Đc cái đặt chậu trên cao nên selfile đỡ phải cúi hay ngồi Phía bên nhà thu hoạch bán dâu, dưa leo, cà chua, trà các loại,... Dưa leo 60k không trái nhỏ ăn ngọt, thơm. Cà chua ăn mát, tươi.",travel,6.4,4,0,0,0,0,0
"PiZa ngon, đồ uống tuyệt vời",foods,9.0,0,0,0,4,0,0
"mình hay ghé quán này mua bánh hoa cúc, vì quán bán ngon giá rẻ so với những chỗ khác vị trí gần chỗ làm mình, nên đi có xí là tới cửa hàng , quán bán online thôi, tới mua nhớ bấm chuông, ai muốn xem menu của quán thì lên fanpage, quán up hạn sử dụng hằng ngày á mình hay đi mua buổi chiều nhưng hôm trước có ghé quán tầm 11h mua, bạn nhân viên đem bánh ra là mình có dự cảm không lành rồi, vì bánh không thơm như mấy đợt trc mình mua, đợt trc mua đem ra là nghe mùi thơm lựng đúng y dự đoán, mình về mở bánh ra thấy đế bánh hơi cứng , chứ không mềm như bình thường, chắc là bánh hôm qua đem bán cho mình rồi, ăn bánh hơi khô, chứ không có mềm mại lắm",foods,7.0,0,0,0,0,0,3
"Sản phẩm đa dạng. Giá cả ổn, thường xuyên có mã giảm giá nên rất rẻ.",shop,8.0,0,0,0,0,0,5
"Phòng hát rộng rãi thoáng mát, hệ thống âm thanh ánh sáng đầy đủ và ổn định, ca khúc upa hạn sử dụng nhanh chất lượng. Dịch vụ tốt, giá cả cũng tàm tạm không quá đắt nhưng cũng không phải là rẻ. Mình đến đây vài lần, lần nào cũng thấy được đón tiếp khá niềm nở chứ không như mấy quán khác, nhân viên hơi lạnh lùng.",entertain,7.2,4,0,0,0,0,0
"Lúc lên núi Sam mình và bạn đã tia chỗ này nên tối quay lại và thiệt không thất vọng. Khu cafe ở đây xây nhô ra ngoài núi, nhìn xuống toàn cảnh thành phố Châu Đốc về đêm, gió lộng, rất tuyệt vời. Giá nước cũng vừa phải, tầm 40, 50k thôi. Nhân viên siêu thân thiện, nói chung rất nên đến nơi này khi ở CD",travel,8.0,5,0,0,5,0,0
"Quán này nhà mình hay đi ăn. Thịt gà vàng ươm, rất ngon nhưng cơm ăn hơi khô. Ngoài gà ra bạn cũng có thể ăn thịt ba chỉ quay hoặc sườn. Ở đây thì bạn nên đi ăn vào buổi tối bởi vì buổi trưa sẽ rất nóng. Giá hơi chát nhưng cũng xứng đáng. Nhân viên thì rất bận vì quán đông người nên bạn phải gọi. Nói chung mình thấy quán này khá ổn nếu bạn đi chung với gia đình hay bạn bè.",foods,7.6,0,0,0,4,0,0
"Trà đào bỏ túi lipton làm gì vậy ạ cho có màu ạ ? ? ? Trà nhạt quá, smOthies đào nhạt quá,1 ly như vậy hơn nửa ly là kem rồi un",shop,3.4,0,0,0,5,0,0
"Nhiều game hay, thú vị, đồ uống ngon. Ở đây thích hợp để tụ tập bạn bè đến để giao lưu, vì quán chuẩn bị nhiều game sẵn frE để chơi. Đồ uống ngon, giá hợp lý. Nhân viên thân thiện",entertain,9.4,0,0,0,5,0,0
"Quán này mở lâu lắm rồi , nằm ngay lề đường của đường Huỳnh Thúc Kháng. Nằm ở giữa đường Ngô Đức Kế với Trần Nguyên Hãn, nên cũng không khó tìm lắm Quán không gian không rộng, nhưng nhìn không được sạch sẽ lắm, vì nằm gần khu chợ xóm mới, Nước mắm để ngay trên bức tường, đợi cô chủ múc hành đưa ra rồi đi chang nước mắm vô thôi. Phục vụ nhanh chóng, không phải chờ lâu. Mình với bạn mình vô ngồi chừng 5p sau là có bánh ăn liền. Giá cả cũng không quá mắc",foods,7.2,0,0,0,5,0,0
"Shop này vừa có đồ trẻ em vừa có thuê áo dài, make up lun, áo dài bên này siêu đẹp, siêu mới lun á, giá thuê tuỳ bộ dao động tầm 700k trở lên thì phải make up nhẹ nhàng, chị chủ thân thiện",wedding,8.0,0,0,0,0,0,5
"Thái độ rất rất tệ, từ người giữ xe đến nhân viên đến người quả n lý. Bảo vệ ghi phiếu vào không khác gì côn đồ. Nhân viên hỏi 2,3 lần đều im lặng. Thật sự rất tệ",edu,1.8,1,0,0,0,0,0
"Đi 4 5 cái Circle K không có cuối cùng cũng được thưởng thức món kem than thần thánh Trước mình cứ thắc mắc không biết vị kem than sẽ ntn vì than hoạt tính mình hay uống thì không có mùi không có vị. Lúc ăn thì thấy vị y như kem socola. Chắc vì than không có vị nên mix socola vào cho dậy mùi. Kem than vị socola nhẹ hơn kem socola bình thường, cảm giác mát nhẹ hơn nên mình khá thích. Các bạn nhân viên thân thiện nhiệt tình chứ không như một số cơ sở khác Vì gần trường nên mình sẽ qua thường xuyên y",shop,8.0,0,0,0,3,0,0
"Mình mới giặt sấy ở cửa hàng Laundromat TV này vừa nhanh, vừa sạch, giá lại rẻ, nhân viên lại thân thiện. Nói chung rất hài lòng",service,10.0,0,0,0,0,0,0
"Quán ở cạnh Lốc city, nếu bạn từ chợ cột ba đi vào thì nó ở cuối chợ Cô bán hàng thân thiện, vui tính, thao tác nhanh. Cực ưng. Không gian có hơi bất tiện vì ồn ào xô bồ, chỗ ngồi nhỏ và luôn đông nên nếu đi tầm 5h xác định là khó kiếm chỗ đó. Kem xôi ở đây siêu đỉnh. Xôi dẻo mềm quyện với kem béo béo, có chút lạc thơm bùi và cốt dừa nữa Chè dừa dầm ăn lạ miệng, không kiểu chuẩn 100 HP mà có biến tấu đi. Mình thấy ăn cũng ổn, phần trân châu bên trong kiểu giòn xốp xốp mình không thấy hợp lắm nhưng bạn mình khen đứt lưỡi chứng tỏ tuỳ khẩu vị Giá cả siêu mềm mại",foods,8.0,0,0,0,4,0,0
"Có bà Dì Hà Nội vào chơi thế là dẫn vào đây mua chả cá về làm quà. Vì chỗ này mình cũng hay mua về ăn. Đi buổi sáng nên chả mới làm ra nóng hổi, thơm lừng. Chả cá Thu, thác lác thì đúng ngon rồi. Có đóng bì sẵn nên cũng thấy hợp vệ sinh và làm quà. Tất nhiên có dịp khác sẽ ghé lại.",shop,8.4,0,0,0,5,0,5
"Khách sạn nôm na là khu làng Pháp .. kiến trúc rất đẹp , đồng phục nv cũng đẹp nốt ..chỉ có một điều giá cả khó hiểu quá , lúc mình đi trên đường đt hỏi giá tham khảo thì nói rõ ràng là bOk 1 phòng 2 người 1 giường là 1 triệu 6 trăm mấy chưa bao gồm bufet , 200k 1người .. Vậy mà khi mình lên thì nói giá một đường khác , thành ra 2 triệu 470 ..Vẫn y một cái giọng nhân viên đó , khi mình hỏi ra lẽ , thì cứ dạ giá đó đó c , mệt quá nhắm mắt thuê phòng vì lúc đó mình rất mệt chỉ muốn nghỉ ngơi .. phòng rất đẹp , thoáng ,ngủ nữa đêm thì nv nấu ăn gì để báo cháy , làm ai cũng hoảng hốt ..nv không nhiệt tình , khi check in lên phòng , không xách hành lí của khách lên giùm , không hỏi han khách có muốn dịch vụ gì , cho đến khi mình check out , cũng phải bắt ngồi đợi gần tiếng đồng hồ để thanh toán trả tiền cọc .. không nghĩ một cái Khách Sạn đạt chuẩn trên Bà Nà lại làm ăn như vậy ..",travel,2.8,0,0,0,0,0,0
"Không thể tưởng tượng được khách sạn lại đẹp đến thế. Không gian thoáng đãng, mát mẻ. Có một sân thượng tuyệt đẹp, nhất là lúc nhâm nhi ly café nhìn từ sân thượng ra thành phố về đêm tuyệt. Mình rất thích khách sạn này. Hy vọng lần sau có cơ hội mình lại đến khách sạn này",travel,10.0,0,5,0,0,0,0
"Chú chủ nói chuyện dễ thương , bạn nữ dắt mình ra vườn cũng dễ thương không kém . Giá 100 ký hợp lý , hôm mình đi hơi ướt được trang bị ủng , được vô vườn chụp hình thoải mái , dâu ngon .",travel,9.8,0,0,0,0,0,0
"Tuy là người không thuộc đạo Thiên Chúa nhưng mình lại hay thích đến nhà thờ để chiêm ngưỡng kiến trúc độc đáo của nhà thờ. Bên cạnh nhà thờ Con Gà của Đà Lạt, nhà thờ Domain De Marie có kiến trúc độc đáo. Màu chủ đạo là màu hồng, tụi mình cực kỳ ấn tượng. Lúc mình đến thì nhà thờ đang làm lễ nên không được vào trong. Đường đến nhà thờ khá khó đi, lại không có người trông xe nên mình cũng không dám đi tham quan toàn cảnh cho lắm. Hy vọng lần sau sẽ có người trông xe để mình được tham quan kỹ hơn.",travel,8.0,4,0,0,0,0,0
"Cuối tuần đi suối lương với gia đình tránh nắng nóng, lần này mình đi khác với lần trước, hình như đã được xây lại, tắm chủ yếu ở cái hồ như hồ bơi à, đá khá bén, đi tắm về trầy xước khắp người, tới đây nhà mình thuê rạp mà hết rồi, phải thuê chiếu để trải từng ô ở cái nhà sàn, đồ ăn ở đây khá ngon và giá cũng khá mềm, mấy cô chú nhân viên ở suối lương cũng rất thân thiện, có nhiều cảnh đẹp để chụp ảnh hay đi dạo, tham quan.",travel,7.0,4,0,0,0,0,0
"Tính mình không thíc hoa hoét vì sợ bị tàn nhanh.. Nhưng hoa này là hoa tươi mãi mãi, hoa bất tử này Hoa này được giao hàng từ trong Đà Lạt ra cho mình đấy ạ Hoa màu đẹp, rất lạ, mà lại thơm nữa ý Đúng là đồ con gái mà, đúng là cái đồ chỉ thíc đẹp thíc điệu mà Giá 1 hộp hoa này là 50k. Hộp này cao tầm 7 cm. Mình thấy các anh, các chú mang hộp này đi tặng các bạn gái thì đảm bảo vừa kinh tế, vừa có ý nghĩa mà bạn gái vẫn thíc ý ạ ",shop,7.6,0,0,0,0,0,5
"Nhân viên nhiệt tình, mỳ cay ăn vào mùa đông rất hợp... Mình ăn rất nhiều lần ở đây r",foods,8.2,0,0,0,5,0,0
...,travel,7.4,0,0,0,0,0,0
"Cơm đồ, nhà gác, nước vác, lợn thui, ngày lui, tháng tới....” Ở Ban Mê điểm tham quan ít nhưng bù lại ẩm thực quá toẹt vời. Hôm nay ăn heo Mường hịn choy oy nó xứt xắc. Heo Mường chỉ ăn rau củ, không ăn cám nên thịt chắc, nhiều nạc, ít mỡ, thơm ngon có vị ngọt thịt tự nhiên khi ăn. Nhất là món giò heo chiên chấm với muối sả, miếng thịt da giòn rụm, thịt săn, thơm mềm. Cơm lam chấm múi mè đen không bị dính tay hay quá ngậy vị nước dừa như ăn nơi khác. Không gian thoải mái, lên món nhanh.",foods,9.4,0,0,0,5,0,0
"Mình ở khách sạn cách 1 căn nhà nên qua đây ăn cơm tối. Quán ở đối diệnstar star star Đức Trọng. Hương vị như cơm nhà, phục vụ nhiệt tình vui vẻ, 40k dĩa có cơm, mặn, xào, canh, nước trà.",foods,8.8,0,0,0,5,0,0
"Kaka mình lại không nghĩ fOdy cho review địa điểm này, mình là tín đồ ba vì đây, tầm 1 tháng 2 tháng lại cuốc 1 chuyến lên Vị trí ở ba vì tất nhiên rồi ạ đi hướng đại lộ thăng long rồi cứ vậy mà thẳng tắp, tiện thể có qua cả thiên đường bảo sơn, làng văn hoá các dân tộc, trên đường đi về các chế có thể tạt té qua . Ở đây có đặc sản sữa bò sữa dê ba vì, cách nhận biết sữa hãng tốt là hãy để ý logo của cửa hàng, nếu nó có 1 quả núi và đồng cỏ.. thì đó là sữa của cty cp ba vì, sữa này tốt, còn nếu trên logo cửa hàng có chữ BV tức Ba Vì thì không nên mua ạ. Trời nắng nóng thế này, lên ba vì sẽ không có sương mù mấy được cái cảnh đẹp nên các chế lên đó sống ảo đi thôi, cách hn có 50km chứ mấy kaka Đồ ăn tốt nhất là mình nên tự chuẩn bị ạ, có thể lên đó làm Bq thì rất tuyệt luôn, có điều nên vứt rác đúng chỗ để bảo tồn thiên nhiên nhé ạ",travel,9.6,4,0,0,4,0,0
"Sáng nay đi qua chân dốc nhà thờ thấy quán bán xôi này khá đông nên em ghé vào mua thử. Xôi xéo được gói cẩn thận vào lá chuối rất chặt tay nên khi mang đến lớp vẫn còn nóng. Xôi được phủ 3 lớp có vị ngọt của lớp đỗ vàng ươm, vị đậm của ruốc, mùi thơm của hành phi khô. Tất cả kết hợp rất hài hoà với xôi tạo nên hương vị tuổi thơ!!! Giá của 1 gói xôi chỉ có 10k .Lại là một gợi ý ăn sáng tuyệt vời cho các bạn học sinh.",foods,8.2,0,0,0,5,0,0
"Hôm nay mình ăn thử món mì ý sốt bò bằm ở Circle K. Sau khi đi dạo một vòng, mình và bạn mình chần chừ một buổi, cuối cùng chọn phần mì ý sốt bò bằm giá là hai mươi lăm nghìn đồng 25k . Nhân viên tử tế, thân thiện, giúp mình hâm nóng mì lại. Sau đó, mình và bạn mình di chuyển lên tầng trên để ngồi dùng phần mì này. Cá nhân mình cảm thấy, sốt cho món mì này hơi lạt, có lẽ tại mình ăn đậm quen rồi. Được cái mùi hương rất thơm, phô mai ít nhưng với giá 25k là quá ok. Mình xin thêm tương cà để mì có phần đậm đà hơn.",shop,8.4,0,0,0,4,0,0
Ở đây bán ăn ngon nhân viên nhiệt tình. Tuy nhiên còn một phần hạn chế là thiếu đùi gà vào 3 lần chả có khi nào được ăn. Đề nghị khắc phục hạn chế nêu trên,foods,4.8,0,0,0,4,0,0
